{
  "$schema": "https://json-schema.org/draft/2020-12/schema",
  "$id": "https://github.com/peixl/ifq-app-builder/clawhub/ifq-app-builder/evals/evals.schema.json",
  "title": "IFQ App Builder ClawHub eval suite",
  "type": "object",
  "required": ["version", "purpose", "quality_principles", "scenarios"],
  "properties": {
    "$schema": { "type": "string" },
    "version": { "type": "string" },
    "purpose": { "type": "string" },
    "quality_principles": { "type": "array" },
    "scenarios": { "type": "array" }
  }
}
